{
  "$schema": "https://json-schema.org/draft/2020-12/schema",
  "$id": "https://github.com/microsoft/chaos-studio/blob/main/copilot-cli-plugin/schemas/chaos-loop/workspace-plan.v1.schema.json",
  "title": "Chaos Loop Workspace Plan v1",
  "description": "Stamped, non-mutating reuse-or-create decision produced by `chaos_loop_state.py workspace-plan` and consumed by `workspace-finalize`.",
  "type": "object",
  "additionalProperties": false,
  "required": [
    "planVersion",
    "contractVersion",
    "runId",
    "expectedStateRevision",
    "evaluation",
    "requestHash",
    "observedAt",
    "decision",
    "selected",
    "createRequest",
    "alternatives",
    "caveats",
    "discoveryEvidence"
  ],
  "properties": {
    "planVersion": { "const": "chaos-loop-workspace-plan/v1" },
    "contractVersion": { "const": "chaos-loop-contract/v1" },
    "runId": { "type": "string", "minLength": 1 },
    "expectedStateRevision": { "type": "integer", "minimum": 0 },
    "evaluation": {
      "type": "object",
      "additionalProperties": false,
      "required": ["engine", "policyVersion"],
      "properties": {
        "engine": { "const": "chaos_loop_state.py" },
        "policyVersion": { "const": "chaos-loop-policy/v2" }
      }
    },
    "requestHash": { "type": "string", "pattern": "^[0-9a-f]{64}$" },
    "observedAt": {
      "type": "string",
      "pattern": "^\\d{4}-\\d{2}-\\d{2}T\\d{2}:\\d{2}:\\d{2}(?:\\.\\d+)?Z$"
    },
    "decision": { "enum": ["reuse", "create"] },
    "selected": { "type": ["object", "null"] },
    "createRequest": {
      "anyOf": [
        { "type": "null" },
        {
          "type": "object",
          "additionalProperties": false,
          "required": [
            "subscriptionId",
            "resourceGroup",
            "workspaceName",
            "location",
            "scopes",
            "identity"
          ],
          "properties": {
            "subscriptionId": { "type": "string", "minLength": 1 },
            "resourceGroup": { "type": "string", "minLength": 1 },
            "workspaceName": {
              "type": "string",
              "pattern": "^[A-Za-z0-9][A-Za-z0-9._-]{0,62}[A-Za-z0-9]$"
            },
            "location": { "type": "string", "pattern": "^[a-z0-9]{3,64}$" },
            "scopes": {
              "type": "array",
              "minItems": 1,
              "uniqueItems": true,
              "items": { "type": "string", "minLength": 1 }
            },
            "identity": {
              "type": "object",
              "required": ["type"],
              "properties": {
                "type": { "enum": ["SystemAssigned", "UserAssigned"] },
                "userAssignedIdentityResourceId": { "type": "string", "minLength": 1 }
              }
            }
          }
        }
      ]
    },
    "alternatives": {
      "type": "array",
      "items": {
        "type": "object",
        "required": ["id", "name", "reason"],
        "properties": {
          "id": { "type": "string", "minLength": 1 },
          "name": { "type": "string", "minLength": 1 },
          "reason": { "type": "string", "minLength": 1 }
        }
      }
    },
    "caveats": { "type": "array", "items": { "type": "string", "minLength": 1 } },
    "discoveryEvidence": {
      "type": "object",
      "additionalProperties": true,
      "required": [
        "source",
        "scope",
        "resourceGroup",
        "observedAt",
        "candidateCount",
        "candidateIds"
      ],
      "properties": {
        "source": { "const": "chaos_list_workspaces" },
        "scope": { "const": "resourceGroup" },
        "resourceGroup": { "type": "string", "minLength": 1 },
        "observedAt": {
          "type": "string",
          "pattern": "^\\d{4}-\\d{2}-\\d{2}T\\d{2}:\\d{2}:\\d{2}(?:\\.\\d+)?Z$"
        },
        "candidateCount": { "type": "integer", "minimum": 0 },
        "candidateIds": { "type": "array", "items": { "type": "string" } },
        "compatibleIds": { "type": "array", "items": { "type": "string" } },
        "rejected": {
          "type": "array",
          "items": {
            "type": "object",
            "required": ["id", "reason"],
            "properties": {
              "id": { "type": "string" },
              "reason": { "type": "string", "minLength": 1 }
            }
          }
        }
      }
    }
  },
  "allOf": [
    {
      "if": { "properties": { "decision": { "const": "reuse" } } },
      "then": {
        "properties": {
          "selected": { "type": "object" },
          "createRequest": { "type": "null" }
        }
      }
    },
    {
      "if": { "properties": { "decision": { "const": "create" } } },
      "then": {
        "properties": {
          "selected": { "type": "null" },
          "createRequest": { "type": "object" }
        }
      }
    }
  ]
}
